<?xml version="1.0" encoding="UTF-8" standalone="yes"?>
<xs:schema elementFormDefault="qualified" xmlns:xs="http://www.w3.org/2001/XMLSchema">
	<xs:include schemaLocation="../modifiers.xsd" />
	<xs:element name="item_skill_enhances">
		<xs:complexType>
			<xs:sequence>
				<xs:element name="item_skill_enhance" type="SkillEnhanceTemplate" minOccurs="0" maxOccurs="unbounded" />
			</xs:sequence>
		</xs:complexType>
	</xs:element>
	<xs:complexType name="SkillEnhanceTemplate">
		<xs:attribute name="id" type="xs:int" use="required" />
		<xs:attribute name="skill_id" type="IntListType" use="required" />
	</xs:complexType>
</xs:schema>